{"adapter":{"id":"test-adapter","profile":"test-profile","version":"1.0.0"},"core_console":{"path":"generated-core.exe","sha256":"0d45f5fd462b8c70bffb10021ac1bcff3f58f29b1faf7568595095427d42812c"},"geometry_limits":{"max_entities":2000,"max_geometry_json_bytes":16777216,"max_inventory_json_bytes":65536,"max_segments":10000},"host_compatibility":{"audit_host_mode":"full_host","core_console_mode":"core_console","host_family":"external-host","host_product":"external-host","host_release":"1.0","host_runtime":"test-runtime","maximum_version":"9.9","minimum_version":"1.0"},"marker_policy":{"enabled":false,"geometry_defaults":{"block_path":[],"overlay_evidence":{"corresponding_right_absent":false,"left_panel":false,"unique_content":false,"unsupported_data":true,"visible_interference":false},"space_kind":"modelspace"},"height_bits":"4004000000000000","layer":"REVIEW","layer_fingerprint":"b3b6039febc1ab8ac04076e32b7b2af0444a6e76164baba744a23e1e4545786a","plugin_capability":false,"policy_version":"marker-policy/v1","profile":"create_review_marker/v1","rotation_bits":"0000000000000000","style":"STANDARD","style_fingerprint":"edc92dc8b0b3f48a6893d4295c809499417bf4a4bccbef8aebd37877d1c4891c","text_derivation_version":"operation-id-suffix/v1","text_prefix":"LPF-REVIEW-"},"operation_profiles":{"create_review_marker/v1":false,"delete_auxiliary_overlay_text/v1":true,"translate_dbtext/v1":true},"plugins":{"readback":{"command":"LPF_NATIVE_EXPORT_MANIFEST","id":"test-plugin","path":"generated-readback.dll","sha256":"bb2b5d56f0c113ac2fd57cf5ee7a7fbc39820dc24d4a04d25d5020017999b06c","version":"1.0.0"},"write":{"command":"LPF_NATIVE_EXECUTE_MANIFEST","id":"test-plugin","path":"generated-write.dll","sha256":"d41760b8cea3dd40830daf83b68e59f06b240a5632de0f87c8942a2dbbc00e49","version":"1.0.0"}},"protocol":{"major":1,"minor":0},"required_capabilities":["read.inventory/v1","read.exact_geometry/v1"],"schema_version":"liang-pingfa/native-adapter-config/v1","timeouts":{"document_ms":5000,"geometry_ms":60000,"health_ms":3000,"inventory_ms":30000,"pipe_connect_ms":5000,"readback_console_seconds":60,"session_ms":3000,"write_console_seconds":120},"write_revision_transition":"save_reopen_changes_revision"}
